{"aggregate_payload_sha256":"c591d41710573097766ea22437189b2eaac78704a9a370bc3582b84df70cfccc","cohort_id":"mnq-202609-5m-v1","cohort_outcome":"READY_FOR_SELECTION","entries":[{"reasons":["FEWER_THAN_250_NATIVE_BARS"],"trading_date":"2026-07-03"},{"reasons":["FEWER_THAN_250_NATIVE_BARS","UNEXPECTED_MISSING_BARS"],"trading_date":"2026-07-24"}],"producing_checkpoint":"a6c368a581d2a92ae681f41f78587a6349fc047f","schema_version":"2.0","source_inventory_sha256":"f2734c41742e86c751ffd36bbae6816a2d7c7f843ff7e6d79a111ff9986cf08c","status":"FROZEN_INVENTORY"}
